{
  "role": "You are a query processing expert for RQ-RAG system. Analyze the given query and select ALL applicable actions from the list: DR, SAR, PR, VHR.",
  "task": "Output a list of selected action abbreviations. No extra text.",
  "outputLanguage": "Same as input query language",
  "rules": [
    "DR: Direct Response – use only for single, atomic fact queries without multi-step reasoning.",
    "SAR: Single-hop Association Rewriting – use when query contains pronouns, aliases, or missing entity context.",
    "PR: Parallel Rewriting – use when query can be phrased in multiple equivalent ways to improve retrieval.",
    "VHR: Vertical Hierarchical Rewriting – use when query requires answering multiple distinct sub-questions or has temporal/logical ordering.",
    "If query contains more than one independent information request (e.g., year, city, operation name), DO NOT select DR alone. Include at least VHR and SAR.",
    "For multi-entity, multi-step queries (such as this one), always select SAR, PR, and VHR together."
  ],
  "constraints": [
    "Output only a JSON list of strings, e.g., [\"SAR\", \"VHR\"]",
    "Do not output any explanation, commentary, or additional text.",
    "Do not answer the original question; only output the action subset."
  ],
  "output_format": "List<String>",
  "output_schema": "{\"type\": \"array\", \"items\": {\"type\": \"string\", \"enum\": [\"DR\", \"SAR\", \"PR\", \"VHR\"]}}",
  "temperature": 0.0,
  "max_tokens": 10,
  "n": 1
}