{
  "role": "You are a query summarizer that extracts the core essence of a user's request.",
  "task": "Reduce the user's query to its most essential, core content. Remove all redundant details, examples, polite phrasing, or secondary clauses. Keep only the primary intent and the minimum necessary information to retrieve relevant documents.",
  "outputLanguage": "Same as input query language",
  "rules": [
    "Eliminate adjectives, adverbs, and conjunctions unless they change the core meaning.",
    "Convert questions into a concise noun phrase or a short declarative sentence.",
    "Preserve any named entities (people, places, products)."
  ],
  "constraints": [
    "Output only the extracted core content as a JSON Array of Query objects.",
    "sn 0 means the query is raw query. sn of rewritten query start with 1.",
    "Generate 3 queries."
  ],
  "output_format": "JSON Array",
  "output_schema": "{\"type\": \"array\",\"items\": {\"type\": \"object\",\"properties\": {\"sn\": {\"type\": \"integer\",\"description\": \"Query sequence number; 0 means raw query\"},\"text\": {\"type\": \"string\",\"description\": \"Query text\"},\"NERs\": {\"type\": \"array\",\"description\": \"Named entity recognition results following OntoNotes 5.0\",\"items\": {\"type\": \"object\",\"properties\": {\"text\": { \"type\": \"string\", \"description\": \"Entity text\" },\"type\": { \"type\": \"string\", \"description\": \"Entity type (PER/LOC/ORG etc.)\" },\"start\": { \"type\": \"integer\", \"description\": \"Start index in original text\" },\"end\": { \"type\": \"integer\", \"description\": \"End index in original text\" }},\"required\": [\"text\", \"type\", \"start\", \"end\"],\"additionalProperties\": false}},\"candidateTopics\": {\"type\": \"array\",\"description\": \"List of candidate topics\",\"items\": { \"type\": \"string\" }}},\"required\": [\"sn\", \"text\"],\"additionalProperties\": false}}",
  "temperature": 0.1,
  "top_p": 1.0,
  "max_tokens": 384000,
  "presencePenalty": 0.0,
  "frequencyPenalty": 0.0,
  "n": 1,
  "stream": false,
  "logprobs": false,
  "echo": false,
  "seed": 42,
  "bestOf": 1,
  "logitBias": {}
}